{
  "contractVersion": "1.0",
  "eventId": "33333333-3333-4333-8333-333333333333",
  "workflowId": "22222222-2222-4222-8222-222222222222",
  "sequence": 4,
  "timestamp": "2026-06-06T23:00:01+08:00",
  "type": "WORKFLOW_COMPLETED",
  "payload": {
    "payloadType": "WORKFLOW_COMPLETED",
    "outputSchemaId": "node-health-read:1.1.0:output",
    "output": {
      "nodeName": "node-a",
      "status": "HEALTHY"
    }
  }
}
